{
  "id": "phoenix",
  "name": "Phoenix",
  "category": "backend",
  "description": "Productive web framework for Elixir with real-time features via channels and LiveView",
  "official_website": "https://phoenixframework.org",
  "documentation": "https://hexdocs.pm/phoenix",
  "github_repository": "https://github.com/phoenixframework/phoenix",
  "license": "MIT",
  "latest_version": "v1.8.13",
  "programming_languages": [
    "Elixir",
    "JavaScript"
  ],
  "platforms": [
    "Linux",
    "macOS",
    "Windows"
  ],
  "package_manager": "mix",
  "installation_examples": {
    "mix": "mix phx.new my_app"
  },
  "tags": [
    "backend",
    "framework",
    "elixir",
    "real-time",
    "liveview",
    "web-framework",
    "distributed",
    "realtime",
    "api-server"
  ],
  "alternatives": [
    "Ruby on Rails",
    "Django",
    "Laravel",
    "Spring Boot"
  ],
  "popularity": 10,
  "maintained": true,
  "archived": false,
  "open_source": true,
  "last_checked": "2026-09-05",
  "last_updated": "2026-09-05",
  "repository_statistics": {
    "stars": 23140,
    "forks": 3109,
    "open_issues": 0,
    "watchers": 0
  }
}