{
  "id": "tauri",
  "name": "Tauri",
  "category": "desktop",
  "description": "Framework for building lightweight, secure desktop applications with web technologies and Rust backend",
  "official_website": "https://tauri.app",
  "documentation": "https://tauri.app/v1/guides",
  "github_repository": "https://github.com/tauri-apps/tauri",
  "license": "Apache-2.0",
  "latest_version": "tauri-v2.11.5",
  "programming_languages": [
    "Rust",
    "TypeScript",
    "JavaScript"
  ],
  "platforms": [
    "Linux",
    "macOS",
    "Windows"
  ],
  "package_manager": "npm",
  "installation_examples": {
    "npm": "npm create tauri-app@latest"
  },
  "tags": [
    "desktop",
    "rust",
    "webview",
    "cross-platform",
    "lightweight",
    "high-performance",
    "desktop-app",
    "mobile-app",
    "native-app",
    "web-frontend"
  ],
  "alternatives": [
    "Electron",
    "Flutter Desktop",
    "Qt",
    "JavaFX"
  ],
  "popularity": 10,
  "maintained": true,
  "archived": false,
  "open_source": true,
  "last_checked": "2026-09-05",
  "last_updated": "2026-09-05",
  "repository_statistics": {
    "stars": 110816,
    "forks": 3915,
    "open_issues": 0,
    "watchers": 0
  }
}