{
  "id": "cloud-run",
  "name": "Google Cloud Run",
  "category": "cloud",
  "description": "Fully managed serverless container platform for deploying apps",
  "official_website": "https://cloud.google.com/run",
  "documentation": "https://cloud.google.com/run/docs",
  "github_repository": "https://github.com/google",
  "license": "MIT",
  "latest_version": "1.0.0",
  "programming_languages": [
    "Generic"
  ],
  "platforms": [
    "Web"
  ],
  "package_manager": "pip",
  "installation_examples": {
    "pip": "pip install cloud-run"
  },
  "tags": [
    "cloud",
    "tool"
  ],
  "alternatives": [],
  "popularity": 5,
  "maintained": true,
  "archived": false,
  "open_source": true,
  "last_checked": "2026-07-12",
  "last_updated": "2026-07-12"
}