{
  "id": "laravel-filament",
  "name": "Filament",
  "category": "frameworks",
  "description": "Accelerated Laravel development framework with admin panel generator",
  "official_website": "https://filamentphp.com",
  "documentation": "https://filamentphp.com/docs",
  "github_repository": "https://github.com/filamentphp",
  "license": "MIT",
  "latest_version": "1.0.0",
  "programming_languages": [
    "Generic"
  ],
  "platforms": [
    "Web"
  ],
  "package_manager": "pip",
  "installation_examples": {
    "pip": "pip install laravel-filament"
  },
  "tags": [
    "frameworks",
    "tool"
  ],
  "alternatives": [],
  "popularity": 5,
  "maintained": true,
  "archived": false,
  "open_source": true,
  "last_checked": "2026-07-12",
  "last_updated": "2026-07-12"
}