{
  "id": "docker-engine",
  "name": "Docker Engine",
  "category": "linux",
  "description": "Container runtime for building and running containerized applications",
  "official_website": "https://docker.com",
  "documentation": "https://docs.docker.com/engine",
  "github_repository": "https://github.com/docker",
  "license": "MIT",
  "latest_version": "1.0.0",
  "programming_languages": [
    "Generic"
  ],
  "platforms": [
    "Web"
  ],
  "package_manager": "pip",
  "installation_examples": {
    "pip": "pip install docker-engine"
  },
  "tags": [
    "linux",
    "tool"
  ],
  "alternatives": [],
  "popularity": 5,
  "maintained": true,
  "archived": false,
  "open_source": true,
  "last_checked": "2026-07-12",
  "last_updated": "2026-07-12"
}