{
  "id": "gson",
  "name": "Gson",
  "category": "libraries",
  "description": "Java library for JSON serialization and deserialization by Google",
  "official_website": "https://github.com/google/gson",
  "documentation": "https://github.com/google/gson",
  "github_repository": "https://github.com/github",
  "license": "MIT",
  "latest_version": "1.0.0",
  "programming_languages": [
    "Generic"
  ],
  "platforms": [
    "Web"
  ],
  "package_manager": "pip",
  "installation_examples": {
    "pip": "pip install gson"
  },
  "tags": [
    "libraries",
    "tool"
  ],
  "alternatives": [],
  "popularity": 5,
  "maintained": true,
  "archived": false,
  "open_source": true,
  "last_checked": "2026-07-12",
  "last_updated": "2026-07-12"
}