{
  "id": "quarkus",
  "name": "Quarkus",
  "category": "backend",
  "description": "Kubernetes-native Java framework optimized for GraalVM and containers",
  "official_website": "https://quarkus.io",
  "documentation": "https://quarkus.io/guides",
  "github_repository": "https://github.com/redisson/redisson",
  "license": "Apache-2.0",
  "latest_version": "redisson-4.7.0",
  "programming_languages": [
    "Java"
  ],
  "platforms": [
    "Web"
  ],
  "package_manager": "pip",
  "installation_examples": {
    "pip": "pip install quarkus"
  },
  "tags": [
    "backend",
    "tool",
    "library",
    "cache",
    "distributed",
    "distributed-locks",
    "executor",
    "hibernate",
    "java",
    "json",
    "lock",
    "map",
    "micronaut",
    "quarkus",
    "queue",
    "redis",
    "redis-client",
    "scheduler",
    "session",
    "spring",
    "tomcat",
    "valkey",
    "valkey-client"
  ],
  "alternatives": [],
  "popularity": 10,
  "maintained": true,
  "archived": false,
  "open_source": true,
  "last_checked": "2026-08-23",
  "last_updated": "2026-08-23",
  "repository_statistics": {
    "stars": 24377,
    "forks": 5489,
    "open_issues": 0,
    "watchers": 0
  }
}