{
  "id": "redis",
  "name": "Redis",
  "category": "database",
  "description": "In-memory data structure store used as a database, cache, and message broker",
  "official_website": "https://redis.io",
  "documentation": "https://redis.io/docs",
  "github_repository": "https://github.com/redis/redis",
  "license": "NOASSERTION",
  "latest_version": "8.10.1",
  "programming_languages": [
    "C"
  ],
  "platforms": [
    "Linux",
    "macOS",
    "Windows"
  ],
  "package_manager": "apt",
  "installation_examples": {
    "apt": "sudo apt install redis-server",
    "brew": "brew install redis",
    "docker": "docker run --name redis -d redis"
  },
  "tags": [
    "database",
    "cache",
    "key-value",
    "in-memory",
    "message-broker",
    "nosql",
    "redis",
    "caching",
    "distributed-systems",
    "open-source",
    "real-time",
    "time-series"
  ],
  "alternatives": [
    "Memcached",
    "Hazelcast",
    "Aerospike",
    "Dragonfly"
  ],
  "popularity": 10,
  "maintained": true,
  "archived": false,
  "open_source": true,
  "last_checked": "2026-08-29",
  "last_updated": "2026-08-29",
  "repository_statistics": {
    "stars": 76135,
    "forks": 24764,
    "open_issues": 0,
    "watchers": 0
  }
}