{
  "id": "weaviate",
  "name": "Weaviate",
  "category": "ai",
  "description": "Open-source vector database with built-in vectorization, hybrid search, and RAG capabilities",
  "official_website": "https://weaviate.io",
  "documentation": "https://weaviate.io/developers/weaviate",
  "github_repository": "https://github.com/weaviate/weaviate",
  "license": "BSD-3-Clause",
  "latest_version": "v1.39.2",
  "programming_languages": [
    "Go",
    "Python"
  ],
  "platforms": [
    "Linux",
    "macOS",
    "Cloud"
  ],
  "package_manager": "docker",
  "installation_examples": {
    "docker": "docker run -d -p 8080:8080 semitechnologies/weaviate:latest"
  },
  "tags": [
    "ai",
    "vector-database",
    "similarity-search",
    "rag",
    "open-source",
    "search-engine",
    "semantic-search",
    "semantic-search-engine",
    "vector-search",
    "vector-search-engine",
    "approximate-nearest-neighbor-search",
    "image-search",
    "hnsw",
    "information-retrieval"
  ],
  "alternatives": [
    "Pinecone",
    "Qdrant",
    "Milvus",
    "Chroma"
  ],
  "popularity": 10,
  "maintained": true,
  "archived": false,
  "open_source": true,
  "last_checked": "2026-09-05",
  "last_updated": "2026-09-05",
  "repository_statistics": {
    "stars": 16785,
    "forks": 1390,
    "open_issues": 0,
    "watchers": 0
  }
}