{
  "id": "dart-flutter",
  "name": "Flutter Packages",
  "category": "mobile",
  "description": "Ecosystem of packages and plugins for Flutter development",
  "official_website": "https://pub.dev",
  "documentation": "https://docs.flutter.dev/packages-and-plugins",
  "github_repository": "https://github.com/pub",
  "license": "MIT",
  "latest_version": "1.0.0",
  "programming_languages": [
    "Generic"
  ],
  "platforms": [
    "Web"
  ],
  "package_manager": "pip",
  "installation_examples": {
    "pip": "pip install dart-flutter"
  },
  "tags": [
    "mobile",
    "tool"
  ],
  "alternatives": [],
  "popularity": 5,
  "maintained": true,
  "archived": false,
  "open_source": true,
  "last_checked": "2026-07-12",
  "last_updated": "2026-07-12"
}