{
  "id": "web3js",
  "name": "Web3.js",
  "category": "blockchain",
  "description": "JavaScript library for interacting with Ethereum blockchain and smart contracts",
  "official_website": "https://web3js.org",
  "documentation": "https://docs.web3js.org",
  "github_repository": "https://github.com/web3js",
  "license": "MIT",
  "latest_version": "1.0.0",
  "programming_languages": [
    "Generic"
  ],
  "platforms": [
    "Web"
  ],
  "package_manager": "pip",
  "installation_examples": {
    "pip": "pip install web3js"
  },
  "tags": [
    "blockchain",
    "tool"
  ],
  "alternatives": [],
  "popularity": 5,
  "maintained": true,
  "archived": false,
  "open_source": true,
  "last_checked": "2026-07-12",
  "last_updated": "2026-07-12"
}